<?xml version="1.0" encoding="UTF-8"?>
<test-battery xmlns="http://ontospread.sf.net"
    xmlns:xsi="http://www.w3.org/2001/XMLSchema-instance"
    >
    <!--xsi:schemaLocation="http://ontospread.sf.net file:/home/chema/pfc/ontospread/trunk/apps/ontospread-test/src/main/xsd/onto-test.xsd"-->
    
    <test>
        <id>Test-1-Restricciones</id>
        <formats>
            <format>tex</format>
            <format>html</format>
        </formats>        
        <outputDirectory>c:/tests</outputDirectory>
        <resources>
            <location>OntoNodrizaFull-local.owl</location>
        </resources>
        <ontoSpreadConfig>
            <functions>
                <function>H1</function>
            </functions>
            <prizePaths>true</prizePaths>
            <restrictions>
           
                <restriction xsi:type="activationRestriction">
                    <config>
                        <init>1.0</init>
                        <step>1</step>
                        <stop>1.0</stop>
                    </config>  
                </restriction>
          
                <!--
                    <restriction xsi:type="contextRestriction">
                        <context>http://websemantica.fundacionctic.org/ontologias/bopa/empleado.owl</context>
                    <retries>
                    <init>10</init>
                    <step>1</step>
                    <stop>10</stop>
                    </retries> 
                    </restriction>
                    -->
               
                <restriction xsi:type="maxConceptsRestriction">
                    <config>
                        <init>5</init>
                        <step>1</step>
                        <stop>5</stop>
                    </config>                    
                </restriction>
                <!--
                <restriction xsi:type="minConceptsRestriction">
                    <config>
                        <init>3</init>
                        <step>1</step>
                        <stop>3</stop>
                    </config>                    
                </restriction>
                -->
                <!--
                   <restriction xsi:type="timeRestriction">
                    <config>
                    <init>100</init>
                    <step>1</step>
                    <stop>100</stop>
                    </config>  
                    </restriction>
                -->
            </restrictions>
            <relations>
                <location>relation-weights.rdf</location>
            </relations>
            <initialConcepts>
                <!--This value can be conflicted with min activation value -->
                <value>1.0</value>
                <initialConcept>
                    <uri>http://websemantica.fundacionctic.org/ontologias/bopa/empleado.owl#Vacaciones</uri>
                    <value>1.0</value>
                </initialConcept>
                <initialConcept>
                    <uri>http://websemantica.fundacionctic.org/ontologias/bopa/ensamble.owl#EmpleadoDeFincas</uri>
                    <value>1.0</value>
                </initialConcept>
            </initialConcepts>
        </ontoSpreadConfig>
    </test>
</test-battery>
